id,username,password,fullname,phone,birthdate,user_type,experience
1,tlevy,12345,tamar levy,0526547788,1990-08-01,counselor,Im a counselor for 5 years now. Love people and hikes.. 
2,mlevy,12345,merav levy,0523332211,1990-07-01,counselor,"Love hikes, everywhere! "
3,dcohen,12345,david cohen,0541113366,1997-01-01,counselor,"Knows all areas In Israel very well..love hikes, people, nature!  "
4,oshalev,12345,omer shalev,0586669878,1996-01-01,counselor,I am a counselor for many years. Love to travel in Israel! 
5,rilluz,12345,raphi illuz,0546663322,1995-01-01,travel-organizer,Responsible for all Beer Sheva schools trips. Looking for good and expirienced counselors! 
6,gzohar,12345,gal zohar,0578986654,1994-01-01,travel-organizer,I own a hiking company for families and groups. Looking for counselors who want to come guide my Hikes. 
7,ryaron,12345,ron yaron,0557879986,1993-01-01,travel-organizer,Need a counselor stat!!
8,aarnon,12345,adi arnon,0523211122,1992-01-01,travel-organizer,Organizing hikes for a group of families. Looking for counselors for those hikes :)